{
  "id": "early-skunk",
  "name": "Early Skunk",
  "aliases": [],
  "kind": "cultivar",
  "status": "draft",
  "summary": "An outdoor-oriented Sensi Seeds hybrid of Skunk #1 and Early Pearl, bred to finish early and resist mould and bud rot in cool, wet climates. The breeder does not give a release year.",
  "born": {
    "unknown": true,
    "display": "undated"
  },
  "origin": {
    "place": "Netherlands (Sensi Seeds)",
    "country": "NL",
    "lat": 52.1,
    "lon": 5.3,
    "evidence": [
      {
        "tier": "breeder-claimed",
        "source": "s2",
        "note": "Sensi lists this among the Skunk #1 hybrids it developed from genetics it received in the Netherlands in 1982."
      }
    ]
  },
  "breeder": {
    "name": "Sensi Seeds",
    "evidence": [
      {
        "tier": "breeder-claimed",
        "source": "s1"
      }
    ]
  },
  "lineage": {
    "status": "known",
    "parents": [
      {
        "id": "skunk-1",
        "evidence": [
          {
            "tier": "breeder-claimed",
            "source": "s1"
          },
          {
            "tier": "breeder-claimed",
            "source": "s2"
          }
        ]
      },
      {
        "id": "early-pearl",
        "evidence": [
          {
            "tier": "breeder-claimed",
            "source": "s1"
          }
        ]
      }
    ],
    "disputes": []
  },
  "traditional_label": "hybrid",
  "growing": {
    "environment": "outdoor",
    "flowering_weeks": {
      "min": 7,
      "max": 9
    }
  },
  "sources": [
    {
      "id": "s1",
      "title": "Early Skunk (regular seeds) product page",
      "publisher": "Sensi Seeds",
      "url": "https://sensiseeds.com/en/regular-seeds/sensi/early-skunk",
      "accessed": "2026-09-24"
    },
    {
      "id": "s2",
      "title": "'Skunk Weed': A Beginner's Guide to Skunk",
      "publisher": "Sensi Seeds",
      "url": "https://sensiseeds.com/en/blog/what-is-skunk-weed-a-beginners-guide-to-skunk/",
      "accessed": "2026-09-24"
    }
  ],
  "updated": "2026-09-24"
}
