{
  "id": "super-skunk",
  "name": "Super Skunk",
  "aliases": [
    "Super Skunk (Sensi Seeds)"
  ],
  "kind": "cultivar",
  "status": "draft",
  "summary": "Sensi Seeds' indica-leaning follow-up to Skunk #1: the original Skunk #1 crossed with an Afghan hash plant to add weight and potency and shorten flowering. The breeder says it launched in 1990 and won a Cannabis Cup soon after. Sensi traces its Skunk #1 stock to seeds brought to the Netherlands from the US in 1982.",
  "born": {
    "year_min": 1982,
    "year_max": 1990,
    "display": "1980s; out by 1990",
    "evidence": [
      {
        "tier": "breeder-claimed",
        "source": "s1",
        "note": "Sensi says Super Skunk was originally launched in 1990."
      },
      {
        "tier": "breeder-claimed",
        "source": "s2",
        "note": "Sensi dates its Skunk #1 stock in the Netherlands to 1982, which bounds the start."
      },
      {
        "tier": "breeder-claimed",
        "source": "s3",
        "note": "Database entry relaying the breeder's 1990 release date."
      }
    ]
  },
  "origin": {
    "place": "Netherlands (Sensi Seeds)",
    "country": "NL",
    "lat": 52.1,
    "lon": 5.3,
    "evidence": [
      {
        "tier": "breeder-claimed",
        "source": "s2",
        "note": "Bred by Sensi Seeds from Skunk #1 genetics it received in the Netherlands."
      }
    ]
  },
  "breeder": {
    "name": "Sensi Seeds",
    "evidence": [
      {
        "tier": "breeder-claimed",
        "source": "s1"
      }
    ]
  },
  "lineage": {
    "status": "known",
    "parents": [
      {
        "id": "skunk-1",
        "evidence": [
          {
            "tier": "breeder-claimed",
            "source": "s1"
          },
          {
            "tier": "breeder-claimed",
            "source": "s2"
          }
        ]
      },
      {
        "id": "afghani",
        "evidence": [
          {
            "tier": "breeder-claimed",
            "source": "s1",
            "note": "Described only as a premium Afghan cultivar; the specific Afghan line is not named."
          },
          {
            "tier": "breeder-claimed",
            "source": "s2",
            "note": "Described as a potent Afghani hash strain."
          }
        ]
      }
    ],
    "disputes": []
  },
  "traditional_label": "indica",
  "growing": {
    "environment": "both",
    "flowering_weeks": {
      "min": 7,
      "max": 11
    }
  },
  "sources": [
    {
      "id": "s1",
      "title": "Super Skunk (regular seeds) product page",
      "publisher": "Sensi Seeds",
      "url": "https://sensiseeds.com/en/regular-seeds/sensi/super-skunk",
      "accessed": "2026-09-24"
    },
    {
      "id": "s2",
      "title": "'Skunk Weed': A Beginner's Guide to Skunk",
      "publisher": "Sensi Seeds",
      "url": "https://sensiseeds.com/en/blog/what-is-skunk-weed-a-beginners-guide-to-skunk/",
      "accessed": "2026-09-24"
    },
    {
      "id": "s3",
      "title": "Super Skunk (Sensi Seeds) strain info",
      "publisher": "SeedFinder",
      "url": "https://seedfinder.eu/en/strain-info/super-skunk/sensi-seeds",
      "accessed": "2026-09-24"
    }
  ],
  "updated": "2026-09-24"
}
